{
  "meta": {
    "version": "0.4.0",
    "id": null,
    "locale": "en-au",
    "created_at": null,
    "updated_at": null,
    "owner_user_id": null,
    "visibility": "private",
    "pii_tier": "low",
    "source_type": "text",
    "source_context": "manual entry",
    "consent_basis": "none",
    "consent_scope": null,
    "consent_revoked_at": null,
    "tags": []
  },
  "core": {
    "anchor": "",
    "spark": null,
    "wound": null,
    "fuel": null,
    "bridge": null,
    "echo": null,
    "narrative": ""
  },
  "constellation": {
    "emotion_primary": "",
    "emotion_subtone": [],
    "higher_order_emotion": null,
    "meta_emotional_state": null,
    "interpersonal_affect": null,
    "narrative_arc": null,
    "relational_dynamics": "",
    "temporal_context": "",
    "memory_type": "",
    "media_format": "text",
    "narrative_archetype": null,
    "symbolic_anchor": null,
    "relational_perspective": "",
    "temporal_rhythm": "",
    "identity_thread": null,
    "expressed_insight": null,
    "transformational_pivot": null,
    "somatic_signature": null
  },
  "milky_way": {
    "event_type": "",
    "location_context": null,
    "associated_people": [],
    "visibility_context": "",
    "tone_shift": null
  },
  "gravity": {
    "emotional_weight": 0.0,
    "emotional_density": "",
    "valence": "",
    "viscosity": "",
    "gravity_type": "",
    "tether_type": null,
    "recall_triggers": [],
    "retrieval_keys": [],
    "nearby_themes": [],
    "legacy_embed": false,
    "recurrence_pattern": null,
    "strength_score": 0.0,
    "temporal_decay": "",
    "resilience_markers": [],
    "adaptation_trajectory": ""
  },
  "impulse": {
    "primary_energy": "",
    "drive_state": "",
    "motivational_orientation": "",
    "temporal_focus": "",
    "directionality": "",
    "social_visibility": "",
    "urgency": "",
    "risk_posture": "",
    "agency_level": "",
    "regulation_state": "",
    "attachment_style": "",
    "coping_style": ""
  },
  "governance": {
    "jurisdiction": null,
    "retention_policy": null,
    "exportability": null,
    "subject_rights": null,
    "k_anonymity": null,
    "policy_labels": [],
    "masking_rules": null
  },
  "telemetry": {
    "extraction_confidence": 0.0,
    "extraction_model": null,
    "extraction_time": null,
    "extraction_flags": []
  },
  "system": {
    "embeddings": [],
    "indices": {
      "waypoint_ids": [],
      "sector_weights": {
        "episodic": 0.0,
        "semantic": 0.0,
        "procedural": 0.0,
        "emotional": 0.0,
        "reflective": 0.0
      }
    }
  },
  "crosswalks": {
    "source_ids": {},
    "external_refs": {},
    "compatibility_tags": []
  }
}
